Nome Servizio,Slug,Collection ID,Item ID,Created On,Updated On,Published On,Titolo,Descrizione Completa,img_copertina,img_copertina_alt,Descrizione Breve,Descrizione Super Breve,Descrizione molto lunga,Card,img_slider,Ha una pagina dedicata,Featured,Video 01,Thumbnail 01,Video 02,Thumbnail 02,Video 03,Thumbnail 03,Link,Link a richiesta,Order,Videos
Acaro della Scabbia,acaro-della-scabbia,61c59c1d76ce2f394189491c,61dc3566c7d00a3278b008de,Mon Jan 10 2022 13:32:22 GMT+0000 (Coordinated Universal Time),Mon Jan 24 2022 14:08:44 GMT+0000 (Coordinated Universal Time),Mon Jan 24 2022 14:20:57 GMT+0000 (Coordinated Universal Time),Acaro della Scabbia,"<p>L’Acaro della scabbia (sarcoptes scabiei) è un parassita che <strong>può infestare sia l’uomo sia gli animali</strong> scavando dei minuscoli cunicoli sottocutanei e provocando, di conseguenza, un <strong>intenso prurito</strong>. Molto fastidioso e debilitante, richiede un intervento immediato e peculiare. Biologica disinfestazioni garantisce professionalità ed efficacia nel pieno rispetto della riservatezza e offre <strong>trattamenti mirati</strong> alla risoluzione del problema.</p><p>‍</p>",https://uploads-ssl.webflow.com/61c59c1d7e0aeb6c54521480/61dc5399a39f803ec234afd1_Acari%20Hero.jpg,Un acaro al microscopio,"L’Acaro della scabbia (sarcoptes scabiei) è un parassita che può infestare sia l’uomo sia gli animali scavando dei minuscoli cunicoli sottocutanei e provocando, di conseguenza, un intenso...",L’Acaro della scabbia (sarcoptes scabiei) è un parassita che può infestare sia l’uomo sia gli animali scavando dei minuscoli cunicoli sottocutanei...,"<p>L’Acaro della scabbia (sarcoptes scabiei) è un parassita che <strong>può infestare sia l’uomo sia gli animali</strong> scavando dei minuscoli cunicoli sottocutanei e provocando, di conseguenza, un <strong>intenso prurito</strong>. Molto fastidioso e debilitante, richiede un intervento immediato e peculiare. Biologica disinfestazioni garantisce professionalità ed efficacia nel pieno rispetto della riservatezza e offre <strong>trattamenti mirati</strong> alla risoluzione del problema.</p><p>‍</p>",https://uploads-ssl.webflow.com/61c59c1d7e0aeb6c54521480/61dc54265a57e2febec76b06_Thumbnail.jpg,https://uploads-ssl.webflow.com/61c59c1d7e0aeb6c54521480/61dc53b015c80a1ff5fb0b17_02.jpg; https://uploads-ssl.webflow.com/61c59c1d7e0aeb6c54521480/61dc53b060b099382821b86b_03.jpg; https://uploads-ssl.webflow.com/61c59c1d7e0aeb6c54521480/61dc352afcccc88ca63a18f8_04.jpg; https://uploads-ssl.webflow.com/61c59c1d7e0aeb6c54521480/61dc53af3ac7a07b507d18d5_05.jpg; https://uploads-ssl.webflow.com/61c59c1d7e0aeb6c54521480/61dc53afc4c8721ce2a1f346_Acaro%20Thumbnail.jpg,false,false,,,,,,,https://www.biologicadisinfestazioni.it/servizi,,6,
Blatte e scarafaggi,blatte-e-scarafaggi,61c59c1d76ce2f394189491c,61e53c2d7ac4a9dc45aecbef,Mon Jan 17 2022 09:51:41 GMT+0000 (Coordinated Universal Time),Mon Jan 24 2022 14:30:19 GMT+0000 (Coordinated Universal Time),Mon Jan 24 2022 14:39:53 GMT+0000 (Coordinated Universal Time),Blatte e scarafaggi,"<p>Pur essendo insetti prettamente notturni, può capitare di vedere blatte e scarafaggi nelle nostre case anche in pieno giorno. Diversamente da quanto si crede, la loro presenza non è sempre sinonimo di scarsa pulizia: questi insetti, infatti, spesso <strong>risalgono dagli scarichi </strong>fognari, il loro habitat preferito, ed entrano in casa anche attraverso la più piccola fessura. Ovviamente possono costituire un <strong>serio pericolo per la salute</strong> dal momento che sono v<strong>ettori di numerosi virus e batteri </strong>e contaminano superfici ed alimenti.</p><p>Blatte e scarafaggi si presentano piuttosto simili ad un occhio inesperto, ma, avendo abitudini e comportamenti diversi, <strong>necessitano di interventi specifici</strong>. <em>Biologica Disinfestazioni</em> effettua un’attenta analisi volta ad identificare la tipologia di parassita e propone, quindi, sempre con attenzione alla salute di persone ed animali domestici, la soluzione più idonea.</p>",https://uploads-ssl.webflow.com/61c59c1d7e0aeb6c54521480/61e53b0c4125ec5c5c5a9be8_Hero.jpg,Scarafaggi morti,"Pur essendo insetti prettamente notturni, può capitare di vedere blatte e scarafaggi nelle nostre case anche in pieno giorno. Diversamente da quanto si crede, la loro presenza non è sempr...","Pur essendo insetti prettamente notturni, può capitare di vedere blatte e scarafaggi nelle nostre case anche in pieno giorno. Diversamente da quan...","<p>Pur essendo insetti prettamente notturni, può capitare di vedere blatte e scarafaggi nelle nostre case anche in pieno giorno. Diversamente da quanto si crede, la loro presenza non è sempre sinonimo di scarsa pulizia: questi insetti, infatti, spesso <strong>risalgono dagli scarichi </strong>fognari, il loro habitat preferito, ed entrano in casa anche attraverso la più piccola fessura. Ovviamente possono costituire un <strong>serio pericolo per la salute</strong> dal momento che sono v<strong>ettori di numerosi virus e batteri </strong>e contaminano superfici ed alimenti.</p><p>Blatte e scarafaggi si presentano piuttosto simili ad un occhio inesperto, ma, avendo abitudini e comportamenti diversi, <strong>necessitano di interventi specifici</strong>. <em>Biologica Disinfestazioni</em> effettua un’attenta analisi volta ad identificare la tipologia di parassita e propone, quindi, sempre con attenzione alla salute di persone ed animali domestici, la soluzione più idonea.</p>",https://uploads-ssl.webflow.com/61c59c1d7e0aeb6c54521480/61e53b1ded304aed140c5abb_Thumbnail.jpg,https://uploads-ssl.webflow.com/61c59c1d7e0aeb6c54521480/61dc5ed5d5bb7034711e3df4_Blate%2001.jpeg; https://uploads-ssl.webflow.com/61c59c1d7e0aeb6c54521480/61dc5ed5256359f6181dc721_Blate%2002.jpeg; https://uploads-ssl.webflow.com/61c59c1d7e0aeb6c54521480/61dc5ed5c4c8720deca26667_Blate%2003.jpeg; https://uploads-ssl.webflow.com/61c59c1d7e0aeb6c54521480/61dc5ed5623c7b554b5a8c39_Blate%2004.jpeg; https://uploads-ssl.webflow.com/61c59c1d7e0aeb6c54521480/61dc5ed5d66dea245a0a5384_Blate%2005.jpeg; https://uploads-ssl.webflow.com/61c59c1d7e0aeb6c54521480/61dc5ed5b2f0d9d08c1a6c35_Blate%2006.jpeg; https://uploads-ssl.webflow.com/61c59c1d7e0aeb6c54521480/61dc5ed5a08a5a23123518c1_Blate%2007.jpeg; https://uploads-ssl.webflow.com/61c59c1d7e0aeb6c54521480/61dc5ed5c9ca1c482673e6e8_Blate%2008.jpeg; https://uploads-ssl.webflow.com/61c59c1d7e0aeb6c54521480/61e7ff2a17f8227f3784eaf9_blatte%2009.jpeg; https://uploads-ssl.webflow.com/61c59c1d7e0aeb6c54521480/61e7ff2ab8c223e06b866a3e_blatte%2010.jpeg; https://uploads-ssl.webflow.com/61c59c1d7e0aeb6c54521480/61e7ff2a50ad888f63aef182_blatte%2011.jpeg; https://uploads-ssl.webflow.com/61c59c1d7e0aeb6c54521480/61e7ff2a7a127bdd87a68518_blatte%20in%20spiaggia%2001.jpg; https://uploads-ssl.webflow.com/61c59c1d7e0aeb6c54521480/61e7ff2973fcca33c0831a78_blatte%20in%20spiaggia.jpg; https://uploads-ssl.webflow.com/61c59c1d7e0aeb6c54521480/61e7ff29c8dd88e571ea7f79_blatte%20in%20spiaggia-min.jpg,false,false,https://youtu.be/FFGNPieQkw0,https://uploads-ssl.webflow.com/61c59c1d7e0aeb6c54521480/61dc5ed5d66dea245a0a5384_Blate%2005.jpeg,https://youtu.be/hQ21v4ZAAdU,https://uploads-ssl.webflow.com/61c59c1d7e0aeb6c54521480/61e7ff2a7a127bdd87a68518_blatte%20in%20spiaggia%2001.jpg,,,http://www.biologicadisinfestazioni.it/servizi/blatte-e-scarafaggi,,7,
Cimici dei letti,cimici-dei-letti,61c59c1d76ce2f394189491c,61cd9a4de4f8261a57149a7d,Thu Dec 30 2021 11:38:53 GMT+0000 (Coordinated Universal Time),Wed Mar 09 2022 14:04:42 GMT+0000 (Coordinated Universal Time),Wed Mar 09 2022 14:20:22 GMT+0000 (Coordinated Universal Time),Cimici dei letti,"<p>Sempre più comuni sono, purtroppo, le <strong>infestazioni da “cimice dei letti”</strong> (cimex lectolarius). Si tratta di un insetto, lungo poco più di mezzo centimetro, dalla forma simile al seme di una mela e dal colore rosso-brunastro. Le cimici dei letti possono vivere un po’ ovunque, anche nei posti più impensabili, ma, nutrendosi di sangue, <strong>prediligono letti e materassi</strong> da cui escono soprattutto di notte attirati dal calore del corpo umano e dall’anidride carbonica che emettiamo respirando. Provocano <strong>fastidiose punture</strong> pruriginose ed è importante <strong>intervenire tempestivamente</strong> con metodi professionali per evitare che pochi esemplari diventino, in brevissimo tempo, una numerosa colonia da cui poi è molto più difficile liberarsi. Biologica Disinfestazioni esegue un controllo accurato così da stanare non solo gli esemplari adulti, ma anche larve e uova e debellare quindi il problema.</p><p>‍</p><p>‍</p>",https://uploads-ssl.webflow.com/61c59c1d7e0aeb6c54521480/61dc5d686d7348376c2c1167_Cimici%20Hero.png,Cimice dei letti,"Sempre più comuni sono, purtroppo, le infestazioni da “cimice dei letti” (cimex lectolarius). Si tratta di un insetto, lungo poco più di mezzo centimetro, dalla forma simile al seme di una...","Le cimici dei letti possono vivere un po’ ovunque, anche nei posti più impensabili, ma, nutrendosi di sangue, prediligono letti e materassi da cui...","<p>Sempre più comuni sono, purtroppo, le <strong>infestazioni da “cimice dei letti”</strong> (cimex lectolarius). Si tratta di un insetto, lungo poco più di mezzo centimetro, dalla forma simile al seme di una mela e dal colore rosso-brunastro. Le cimici dei letti possono vivere un po’ ovunque, anche nei posti più impensabili, ma, nutrendosi di sangue, <strong>prediligono letti e materassi</strong> da cui escono soprattutto di notte attirati dal calore del corpo umano e dall’anidride carbonica che emettiamo respirando. Provocano <strong>fastidiose punture</strong> pruriginose ed è importante <strong>intervenire tempestivamente</strong> con metodi professionali per evitare che pochi esemplari diventino, in brevissimo tempo, una numerosa colonia da cui poi è molto più difficile liberarsi. Biologica Disinfestazioni esegue un controllo accurato così da stanare non solo gli esemplari adulti, ma anche larve e uova e debellare quindi il problema.</p><p>‍</p>",https://uploads-ssl.webflow.com/61c59c1d7e0aeb6c54521480/61dc5d6c625ea2144168d663_Cimici%20Thumbnail.jpg,https://uploads-ssl.webflow.com/61c59c1d7e0aeb6c54521480/61dc5d87625ea2976468d713_Cimici%20dei%20letti%2001.jpeg; https://uploads-ssl.webflow.com/61c59c1d7e0aeb6c54521480/61dc5d877d99a5897c3a6d7b_Cimici%20dei%20letti%2002.jpeg; https://uploads-ssl.webflow.com/61c59c1d7e0aeb6c54521480/61dc5d8728ec53fac5710774_Cimici%20dei%20letti%2003.jpg; https://uploads-ssl.webflow.com/61c59c1d7e0aeb6c54521480/61dc5d87a08a5a46bd350aba_Cimici%20dei%20letti%2004.jpeg; https://uploads-ssl.webflow.com/61c59c1d7e0aeb6c54521480/61dc5d87a39f803ee434f254_Cimici%20dei%20letti%2005.jpg; https://uploads-ssl.webflow.com/61c59c1d7e0aeb6c54521480/61dc5d87d66dea69b10a49dd_Cimici%20dei%20letti%2006.jpeg; https://uploads-ssl.webflow.com/61c59c1d7e0aeb6c54521480/61dc5d878398d7ca36e2eb1e_Cimici%20dei%20letti%2007.jpeg; https://uploads-ssl.webflow.com/61c59c1d7e0aeb6c54521480/61dc5d87821bec1356e37417_Cimici%20dei%20letti%2008.jpeg; https://uploads-ssl.webflow.com/61c59c1d7e0aeb6c54521480/61dc5d87240512dd7daac17f_Cimici%20dei%20letti%2009.jpeg; https://uploads-ssl.webflow.com/61c59c1d7e0aeb6c54521480/61dc5d878f9139d58762e4d3_Cimici%20dei%20letti%2010.jpeg,true,false,https://youtu.be/EgL4JSIXFok,https://uploads-ssl.webflow.com/61c59c1d7e0aeb6c54521480/61dc5d87a39f803ee434f254_Cimici%20dei%20letti%2005.jpg,https://youtu.be/Mz1UFGZ_Iyw,https://uploads-ssl.webflow.com/61c59c1d7e0aeb6c54521480/61dc5d6c625ea2144168d663_Cimici%20Thumbnail.jpg,https://youtu.be/ceG9k6IPSNo,https://uploads-ssl.webflow.com/61c59c1d7e0aeb6c54521480/61dc5d8728ec53fac5710774_Cimici%20dei%20letti%2003.jpg,http://www.biologicadisinfestazioni.it/servizi/cimici-dei-letti,http://www.biologicadisinfestazioni.it/servizi/cimici-dei-letti,8,
Disinfestazioni,disinfestazione,61c59c1d76ce2f394189491c,61c59c9fd6a0723f3fd0df4b,Fri Dec 24 2021 10:10:39 GMT+0000 (Coordinated Universal Time),Mon May 02 2022 14:00:59 GMT+0000 (Coordinated Universal Time),Mon May 02 2022 14:31:22 GMT+0000 (Coordinated Universal Time),Disinfestazioni,"<p>L’esperienza maturata consente a <strong>Biologica Disinfestazioni</strong> di riconoscere con facilità <strong>vari tipi di parassiti</strong> e di proporre, quindi, la <strong>soluzione più adatta</strong>. <strong>Zanzare</strong>, <strong>blatte</strong> (scarafaggi), <strong>vespe</strong>, <strong>calabroni</strong>, <strong>pulci</strong>, <strong>zecche</strong>, <strong>formiche</strong>, <strong>mosche</strong>, <strong>cimici asiatiche</strong>, <strong>cimici dei letti, pidocchi, scorpioni, ragni, pesciolini d'argento, tarme dei tessuti</strong> e <strong>tarli</strong> sono fra i parassiti che si trovano più di frequente. Biologica Disinfestazioni, grazie a tecniche innovative e <strong>prodotti con un minor impatto ambientale e</strong> autorizzati dal <strong>Ministero della Sanità</strong>, risolve in modo efficace tutti i problemi di infestazione, sempre con un occhio di riguardo alla salute di persone e animali domestici.</p>",https://uploads-ssl.webflow.com/61c59c1d7e0aeb6c54521480/61e54037d3b10d27d6c3de4b_wepik-2022017-103643-min.jpg,Una zanzara tigre.,"L’esperienza maturata consente a Biologica Disinfestazioni di riconoscere con facilità vari tipi di parassiti e di proporre, quindi, la soluzione più adatta...",L’esperienza maturata consente a Biologica Disinfestazioni di riconoscere con facilità vari tipi di parassiti e di...,"<p>L’esperienza maturata consente a <strong>Biologica Disinfestazioni</strong> di riconoscere con facilità <strong>vari tipi di parassiti</strong> e di proporre, quindi, la <strong>soluzione più adatta</strong>. <strong>Zanzare</strong>, <strong>blatte</strong> (scarafaggi), <strong>vespe</strong>, <strong>calabroni</strong>, <strong>pulci</strong>, <strong>zecche</strong>, <strong>formiche</strong>, <strong>mosche</strong>, <strong>cimici asiatiche</strong>, <strong>cimici dei letti, pidocchi, scorpioni, ragni, pesciolini d'argento, tarme dei tessuti</strong> e <strong>tarli</strong> sono fra i parassiti che si trovano più di frequente. Biologica Disinfestazioni, grazie a tecniche innovative e <strong>prodotti con un minor impatto ambientale e</strong> autorizzati dal <strong>Ministero della Sanità</strong>, risolve in modo efficace tutti i problemi di infestazione, sempre con un occhio di riguardo alla salute di persone e animali domestici.</p>",https://uploads-ssl.webflow.com/61c59c1d7e0aeb6c54521480/61e54037d3b10d27d6c3de4b_wepik-2022017-103643-min.jpg,https://uploads-ssl.webflow.com/61c59c1d7e0aeb6c54521480/626fe31475c056921b68add8_WhatsApp%20Image%202022-05-02%20at%2009.17.28%20(1).jpeg; https://uploads-ssl.webflow.com/61c59c1d7e0aeb6c54521480/626fe314595d3f844af1c764_WhatsApp%20Image%202022-05-02%20at%2009.17.28.jpeg; https://uploads-ssl.webflow.com/61c59c1d7e0aeb6c54521480/626fe3fa94695f80a4e69d6d_WhatsApp%20Image%202022-05-02%20at%2009.26.42.jpeg; https://uploads-ssl.webflow.com/61c59c1d7e0aeb6c54521480/61dc5edd8f913982f962eb28_Formiche%2001.jpeg; https://uploads-ssl.webflow.com/61c59c1d7e0aeb6c54521480/61dc5edd60b0998f3e21eb7a_Formiche%2003.jpeg; https://uploads-ssl.webflow.com/61c59c1d7e0aeb6c54521480/61e7e6730c0161756ef58c6f_WhatsApp%20Image%202022-01-19%20at%2010.54.24-min.jpeg; https://uploads-ssl.webflow.com/61c59c1d7e0aeb6c54521480/61e7fb2566796eafa7ab43bf_Processionaria01-min.jpeg; https://uploads-ssl.webflow.com/61c59c1d7e0aeb6c54521480/61e7fb2598543471c40d36e3_Processionaria02-min.jpeg; https://uploads-ssl.webflow.com/61c59c1d7e0aeb6c54521480/61e7fb257991179a8ac6be83_Processionaria04-min.jpg; https://uploads-ssl.webflow.com/61c59c1d7e0aeb6c54521480/61e7fb252110108ee26537cc_Processionaria05-min.jpg; https://uploads-ssl.webflow.com/61c59c1d7e0aeb6c54521480/61dc53b015c80a1ff5fb0b17_02.jpg; https://uploads-ssl.webflow.com/61c59c1d7e0aeb6c54521480/61dc352afcccc88ca63a18f8_04.jpg; https://uploads-ssl.webflow.com/61c59c1d7e0aeb6c54521480/61dc5ed5d5bb7034711e3df4_Blate%2001.jpeg; https://uploads-ssl.webflow.com/61c59c1d7e0aeb6c54521480/61e7ff2a17f8227f3784eaf9_blatte%2009.jpeg; https://uploads-ssl.webflow.com/61c59c1d7e0aeb6c54521480/61e7ff2a50ad888f63aef182_blatte%2011.jpeg; https://uploads-ssl.webflow.com/61c59c1d7e0aeb6c54521480/61eebc3b90c02c29a9ec5c5f_07-min.jpg; https://uploads-ssl.webflow.com/61c59c1d7e0aeb6c54521480/61f15499695f17907651e421_zecca%20molle%20free-min.jpg,true,true,https://youtu.be/Y7Dd4952b80,https://uploads-ssl.webflow.com/61c59c1d7e0aeb6c54521480/61dc5eddd66dea4b420a538b_Formiche%2002.jpeg,https://youtu.be/FFGNPieQkw0,https://uploads-ssl.webflow.com/61c59c1d7e0aeb6c54521480/61dc5ed5a08a5a23123518c1_Blate%2007.jpeg,https://youtu.be/H2iVEToz0c4,https://uploads-ssl.webflow.com/61c59c1d7e0aeb6c54521480/61e7fb252110108ee26537cc_Processionaria05-min.jpg,http://www.biologicadisinfestazioni.it/servizi/disinfestazione,http://www.biologicadisinfestazioni.it/servizi/disinfestazione,6,
Certificazioni H.A.C.C.P.,haccp,61c59c1d76ce2f394189491c,61c59d43cb9ad68b8484e9ce,Fri Dec 24 2021 10:13:23 GMT+0000 (Coordinated Universal Time),Wed Mar 09 2022 14:10:06 GMT+0000 (Coordinated Universal Time),Wed Mar 09 2022 14:20:22 GMT+0000 (Coordinated Universal Time),Certificazioni H.A.C.C.P.,"<p>Il <strong>protocollo H.A.C.C.P.</strong>, ovvero il sistema di analisi dei rischi e punti di controllo critico, è <strong>obbligatorio in Italia</strong> dal 2016 (D.L. 193/07) e deve essere seguito da tutte le realtà operanti nel <strong>settore alimentare</strong> (bar, pasticcerie, ristoranti, gastronomie, panifici, mense, scuole, eventi enogastronomici, sagre, case di riposo, magazzini alimentari…). </p><p>Biologica Disinfestazioni analizza ed individua i potenziali problemi legati alle infestazioni da roditori, insetti striscianti e volanti così da attuare un efficace protocollo di prevenzione. <strong>Monitorando i rischi</strong> e <strong>facendo prevenzione</strong> in tutte le fasi della lavorazione di un prodotto alimentare (dalle aziende agricole fino a quelle che si occupano della lavorazione, dello stoccaggio e della vendita) <strong>garantisce la tutela della salute</strong> del consumatore finale. Inoltre, con interventi regolari e pianificati, riesce a monitorare costantemente e a <strong>risolvere sul nascere</strong> eventuali infestazioni, garantendo così il rispetto del protocollo H.A.C.C.P.</p><p>‍</p>",https://uploads-ssl.webflow.com/61c59c1d7e0aeb6c54521480/61dc5868f5fd9b014af62ff3_Hero.jpg,Un cuoco nella cucina di un ristorante.,"Il protocollo H.A.C.C.P., ovvero il sistema di analisi dei rischi e punti di controllo critico, è obbligatorio in Italia dal 2016 (D.L. 193/07) e deve essere seguito da tutte le realtà operanti...","Il protocollo H.A.C.C.P., ovvero il sistema di analisi dei rischi e punti di controllo critico, è obbligatorio in Italia dal 2016 (D.L. 193/07) e...","<p>Il <strong>protocollo H.A.C.C.P.</strong>, ovvero il sistema di analisi dei rischi e punti di controllo critico, è <strong>obbligatorio in Italia</strong> dal 2016 (D.L. 193/07) e deve essere seguito da tutte le realtà operanti nel <strong>settore alimentare</strong> (bar, pasticcerie, ristoranti, gastronomie, panifici, mense, scuole, eventi enogastronomici, sagre, case di riposo, magazzini alimentari…). </p><p>Biologica Disinfestazioni analizza ed individua i potenziali problemi legati alle infestazioni da roditori, insetti striscianti e volanti così da attuare un efficace protocollo di prevenzione. <strong>Monitorando i rischi</strong> e <strong>facendo prevenzione</strong> in tutte le fasi della lavorazione di un prodotto alimentare (dalle aziende agricole fino a quelle che si occupano della lavorazione, dello stoccaggio e della vendita) <strong>garantisce la tutela della salute</strong> del consumatore finale. Inoltre, con interventi regolari e pianificati, riesce a monitorare costantemente e a <strong>risolvere sul nascere</strong> eventuali infestazioni, garantendo così il rispetto del protocollo H.A.C.C.P.</p><p>‍</p>",https://uploads-ssl.webflow.com/61c59c1d7e0aeb6c54521480/61dc58717d37d9875a44c1fa_Thumbnail.jpg,https://uploads-ssl.webflow.com/61c59c1d7e0aeb6c54521480/61dc587eba42f82dc862184f_HACCP%2001.jpg; https://uploads-ssl.webflow.com/61c59c1d7e0aeb6c54521480/61dc5881e9e97b43000d012a_Blatte%20al%20ristorante.jpeg; https://uploads-ssl.webflow.com/61c59c1d7e0aeb6c54521480/61dc588373f74eca4cb4c919_Blatte%20in%20cucina.jpeg,true,true,,,,,,,http://www.biologicadisinfestazioni.it/servizi/haccp,http://www.biologicadisinfestazioni.it/servizi/haccp,2,
Infestanti degli Allevamenti Avicoli,infestanti-dei-pollai-e-degli-allevamenti-avicoli,61c59c1d76ce2f394189491c,61dc1ea610b9b49c29b29c47,Mon Jan 10 2022 11:55:18 GMT+0000 (Coordinated Universal Time),Wed Mar 09 2022 14:12:42 GMT+0000 (Coordinated Universal Time),Wed Mar 09 2022 14:20:22 GMT+0000 (Coordinated Universal Time),Infestanti degli Allevamenti Avicoli,"<p>I più comuni sono l’<strong>acaro rosso del pollo</strong> (Dermanyssus Gallinae), la <strong>zecca molle</strong> (Argas Reflexus) e il <strong>pidocchio del pollo</strong> (Mallophaga). Sono parassiti molto infestanti e costituiscono una <strong>seria minaccia per la salute degli animali</strong>. Il forte stress a cui viene sottoposto l’animale infestato, infatti, ne compromette la crescita e ne <strong>riduce notevolmente - in quantità e qualità - la produzione di uova</strong> (nel caso di galline ovaiole) costituendo così un <strong>grave danno economico</strong> per il produttore. Inoltre, se non si interviene tempestivamente, l’infestazione può diffondersi ad altri soggetti sani e alle generazioni future.</p>",https://uploads-ssl.webflow.com/61c59c1d7e0aeb6c54521480/61dc5fbac7d00a9611b16588_Hero.jpg,Galline bianche che mangiano.,"Sono parassiti molto infestanti e costituiscono una seria minaccia per la salute degli animali. Se non si interviene tempestivamente, l’infestazione può propagarsi ad altri...",Sono parassiti molto infestanti e costituiscono una seria minaccia per la salute degli animali. Se non si interviene tempestivamente...,"<p>I più comuni sono l’<strong>acaro rosso del pollo</strong> (Dermanyssus Gallinae), la <strong>zecca molle</strong> (Argas Reflexus) e il <strong>pidocchio del pollo</strong> (Mallophaga). Sono parassiti molto infestanti e costituiscono una <strong>seria minaccia per la salute degli animali</strong>. Il forte stress a cui viene sottoposto l’animale infestato, infatti, ne compromette la crescita e ne <strong>riduce notevolmente - in quantità e qualità - la produzione di uova</strong> (nel caso di galline ovaiole) costituendo così un <strong>grave danno economico</strong> per il produttore. Inoltre, se non si interviene tempestivamente, l’infestazione può diffondersi ad altri soggetti sani e alle generazioni future.</p><p>‍</p>",https://uploads-ssl.webflow.com/61c59c1d7e0aeb6c54521480/61dc5fbf623c7bc4c45a936b_Thumbnail-min.jpg,https://uploads-ssl.webflow.com/61c59c1d7e0aeb6c54521480/61dc5fcdd66dea48330a57ac_06-min.jpg; https://uploads-ssl.webflow.com/61c59c1d7e0aeb6c54521480/620236c99d5670074567beea_Acaro%20rosso%20S-min.jpg; https://uploads-ssl.webflow.com/61c59c1d7e0aeb6c54521480/620236c92496174f6b944143_pidocchi%20delle%20galline%2001%20S-min.jpg; https://uploads-ssl.webflow.com/61c59c1d7e0aeb6c54521480/620236c9668cd821d1c84735_pidocchi%20delle%20galline%20S-min.jpg,true,true,,,,,,,http://www.biologicadisinfestazioni.it/servizi/infestanti-dei-pollai-e-degli-allevamenti-avicoli,http://www.biologicadisinfestazioni.it/servizi/infestanti-dei-pollai-e-degli-allevamenti-avicoli,5,
